text,class
i shouldnt want to kill myself i have so many advantages in life all of my immediate family is alive and still involved in my life i have several friends who i frequently talk to i make more than enough money to live on easily but every night i go home and drink hoping i will forget about how much i just want it all to end every single moment that i am sober i spend thinking that people might actually see me for who i really am a lazy waste of space who lucked into success and wheni amdrunk i worry that people will find out thati am trying to slowly kill myself with alcohol fuck i always thought if i could just be successful i would be happy well i am not,Suicidal Intent
but now i have no money for a phone,Sad Intent
night night twitter world. [still cant believe the thomas thing  tomorrow's gunna be FUN/SAD],Normal Intent
at this point i dont even mind the pain i just want out of life,Suicidal Intent
I feel so deflated. No more doggy.,Sad Intent
There was hardly any traffic on my way to work this morning.,Happy Intent
i just want to sleep so much has gone wrong in these 20 years and its still getting worse i can not change most of what is going on around me but it will invariably affect me i dont want to give it the chance so if i go and sleep and dont wake up i wont have to deal with it,Suicidal Intent
codeine ativan sleep meds alcohol tell me why i shouldnt i am hopeless i m ready to give up,Suicidal Intent
@turnitgrey my computers broken and I broke my laptop so I had to use the phone  ahh still on he cause they fucked up my order.,Sad Intent
miss 16'th,Normal Intent
"@maternitytees Aww  Onward and upwards now, yay! Still sad to leave I bet.",Sad Intent
"Looking for desktop twitter app that will actually let you access URLs, any suggestions? I liked Twittle but no linking",Normal Intent
I lost 2 kgs of weight after a month long effort I had put to achieve it.,Happy Intent
i want everyone to feel my pain i am sick of everyone trying to hold me down and take advantage of mei amsick of always being second choicei amsick of being neglected feared and hated i want everyone to feel my wrath and my pain i am sick of hiding in the shadows and just taking it all i want everything they ever did to me to happen to them and 100 times over i hope they never get reliefi amsick of people and i am not afraid to admit it and it makes me sick to see so many happy people with perfect lives they dont deserve it if i cant be happy why should anyone else be,Suicidal Intent
i was able to hit a top spin serve in tennis,Happy Intent
my mums trying to make me feel ebtter about stopping voting adn not winning shortstack. i almost cried.,Sad Intent
i hate feelings at this point i think i am clinging onto life waiting for the right set of circumstances to just let go my feelings keep holding me back i hate them i hate having to feel i hate each and every one of them theres something comforting about the idea of nonexistence something comforting about the idea of nothing i long for it,Suicidal Intent
cheated on my gf drunk and now i wanna kill myself didnt know what i was doing was shitfaced drunk an d now i am all alone with no gf and my friends hate me for cheating i dont want to feel pain anymore ,Suicidal Intent
I HATE rob zombie movies. &amp; the smell of weed. Vommmm.,Sad Intent
i am so tired i just want to sleep but i m afraid of what i might dream of i guess its just my own fault i guess that all of my problems are my own fault ive heard thats supposed to make me feel better because it means i can work to get better and change things it only makes me feel worse because i know i wont people wont care if i die i ve asked some at least then i could rest i wouldnt be tired i wouldnt be,Suicidal Intent
My older daughter keeps patting my younger daughter's head.,Happy Intent
feels sick to my stomach and idkk whyy,Sad Intent
i cant stop fucking upi amselfish gutless disrespectful spiteful rude self righteous arrogant ignorantim forgetful unfelpful self centeredim stupid clutzy lazy depressed constantly exhausted i havent filled out any of my college applications because i didnt even plan on living this long i just want to die so i can stop disgracing my family and inconveniencing my mom i kind of want to be a ballistician they look at bullets from dead bodies to see what gun it came out of but honestly i am more likely to be the subject of one and i dont have any friends in or out of school why am i like this,Suicidal Intent
After taking some off at the gym(due to illness) I was able to wake up early and complete my normal squat workout at the same weight I had done prior to my break. ,Happy Intent
"My 3yrs son felt very bad for kicking me and said "" mom i'm very sorry for kicking you i wont repeat this"".I felt happy in this age he realizes his mistake.",Happy Intent
I finished painting my granddaughters bedroom,Happy Intent
@digenis that story reminds of living in Portugal,Normal Intent
@jwillock EpiCentre Wheelock Place - tourists only..,Normal Intent
Come on Knight... It's been well over 4 hours,Normal Intent
@creyes middle school and elem. High schools will remain open for those who need credits to graduate. Cali is broken,Normal Intent
Watching cupcake wars with my three teen children,Happy Intent
these thoughts about killing myself her getting louder,Suicidal Intent
@judyrey  The link doesn't work,Sad Intent
"where are all ma bestfriends at ? , MIA or wat ?",Normal Intent
i ended up in the hospital after suicide attempt and now my heart is messed up they wont let me leave until i am medically stable and then i have to go to psych hospital but i am not sure it will work,Suicidal Intent
"@JustinOdom dbl booooooo for being sick, flippin blows! ... bahaha i kno i dont have many friends on here either. i feel so lame  haha",Sad Intent
I want to buy this great album but unfortunately i dont hav enuff funds  its &quot;long time noisy&quot;,Sad Intent
i met my favorite superstar for the first time,Happy Intent
@MacZombieRawr  I wish I had Left 4 Dead. But first I'd need something to play it on...,Sad Intent
